{
  "$schema": "http://json-schema.org/draft-07/schema#",
  "$id": "https://github.com/RodrigoMardones/handyman/assets/schemas/feature_list.schema.json",
  "title": "Handyman feature_list.json",
  "description": "Backlog and state machine for a Handyman harness.",
  "type": "object",
  "required": ["project", "features"],
  "additionalProperties": false,
  "properties": {
    "project": { "type": "string", "minLength": 1 },
    "description": { "type": "string" },
    "config": { "$ref": "#/definitions/config" },
    "rules": { "$ref": "#/definitions/rules" },
    "features": {
      "type": "array",
      "items": { "$ref": "#/definitions/feature" }
    }
  },
  "definitions": {
    "config": {
      "type": "object",
      "required": ["install_mode", "project_name", "project_root", "harness_workspace"],
      "additionalProperties": false,
      "properties": {
        "install_mode": { "type": "string", "enum": ["local", "global"] },
        "project_name": { "type": "string", "minLength": 1 },
        "project_root": { "type": "string", "minLength": 1 },
        "handyman_root": { "type": ["string", "null"] },
        "harness_workspace": { "type": "string", "minLength": 1 },
        "harness_version": { "type": "string", "pattern": "^\\d+\\.\\d+\\.\\d+$" },
        "discovery": { "$ref": "#/definitions/discovery" },
        "post_run": { "$ref": "#/definitions/command_list" }
      }
    },
    "discovery": {
      "type": "object",
      "additionalProperties": false,
      "properties": {
        "skills": { "type": "array", "items": { "type": "string", "minLength": 1 }, "uniqueItems": true },
        "mcp": { "type": "array", "items": { "type": "string", "minLength": 1 }, "uniqueItems": true },
        "agents": { "type": "array", "items": { "type": "string", "minLength": 1 }, "uniqueItems": true }
      }
    },
    "command_list": {
      "type": "array",
      "items": { "type": "string", "minLength": 1 },
      "uniqueItems": true
    },
    "rules": {
      "type": "object",
      "additionalProperties": false,
      "properties": {
        "one_feature_at_a_time": { "type": "boolean" },
        "require_tests_to_close": { "type": "boolean" },
        "valid_status": {
          "type": "array",
          "items": { "type": "string", "enum": ["pending", "in_progress", "done", "blocked"] },
          "uniqueItems": true
        }
      }
    },
    "feature": {
      "type": "object",
      "required": ["id", "name", "status"],
      "additionalProperties": false,
      "properties": {
        "id": { "type": "integer", "minimum": 1 },
        "name": { "type": "string", "minLength": 1 },
        "title": { "type": "string" },
        "description": { "type": "string" },
        "acceptance": {
          "type": "array",
          "items": { "type": "string" }
        },
        "status": { "type": "string", "enum": ["pending", "in_progress", "done", "blocked"] },
        "blocked_reason": { "type": "string" }
      }
    }
  }
}
